{
  "$schema": "instruction-catalog.schema.json",
  "schemaVersion": 1,
  "lastSemanticReview": "2026-08-31",
  "ruleDefaults": {
    "requirementLevel": "mandatory",
    "enforcementMethod": "model-based",
    "documentationGap": false
  },
  "sources": [
    { "id": "best-practices", "title": "Best Practices", "rawUrl": "https://raw.githubusercontent.com/hashicorp/terraform-provider-azurerm/main/contributing/topics/best-practices.md", "referenceUrl": "https://github.com/hashicorp/terraform-provider-azurerm/blob/main/contributing/topics/best-practices.md", "baselineSha256": "0ef125f52ff74ab1c4531531269f9191ec671cacc388c631fa27198ddf424a8d" },
    { "id": "schema-design-considerations", "title": "Schema Design Considerations", "rawUrl": "https://raw.githubusercontent.com/hashicorp/terraform-provider-azurerm/main/contributing/topics/schema-design-considerations.md", "referenceUrl": "https://github.com/hashicorp/terraform-provider-azurerm/blob/main/contributing/topics/schema-design-considerations.md", "baselineSha256": "1b1b12cfb8962cde476e15a68e84f89595c9eee0a273ab51800aaafe7a4dfa30" },
    { "id": "reference-errors", "title": "Working with Errors", "rawUrl": "https://raw.githubusercontent.com/hashicorp/terraform-provider-azurerm/main/contributing/topics/reference-errors.md", "referenceUrl": "https://github.com/hashicorp/terraform-provider-azurerm/blob/main/contributing/topics/reference-errors.md", "baselineSha256": "380567682e3e3e197a0e509ec1b67c442bb4d01e65546c2af0740d3e4bf21c38" },
    { "id": "reference-acceptance-testing", "title": "Acceptance Testing", "rawUrl": "https://raw.githubusercontent.com/hashicorp/terraform-provider-azurerm/main/contributing/topics/reference-acceptance-testing.md", "referenceUrl": "https://github.com/hashicorp/terraform-provider-azurerm/blob/main/contributing/topics/reference-acceptance-testing.md", "baselineSha256": "a452e1f67d91fe14d0d29cfb9a6dbf994727943925e7304e3583f884daba8572" },
    { "id": "reference-documentation-standards", "title": "Provider Documentation Standards", "rawUrl": "https://raw.githubusercontent.com/hashicorp/terraform-provider-azurerm/main/contributing/topics/reference-documentation-standards.md", "referenceUrl": "https://github.com/hashicorp/terraform-provider-azurerm/blob/main/contributing/topics/reference-documentation-standards.md", "baselineSha256": "5a32d98fb9f70461e216cd89a1a8347aa8684c508897a0402df3e2c711391843" },
    { "id": "guide-new-resource", "title": "Guide: New Resource", "rawUrl": "https://raw.githubusercontent.com/hashicorp/terraform-provider-azurerm/main/contributing/topics/guide-new-resource.md", "referenceUrl": "https://github.com/hashicorp/terraform-provider-azurerm/blob/main/contributing/topics/guide-new-resource.md", "baselineSha256": "3ed25d9bcfe71aea8c836c97c6434cc64909099f9210b7723401ccd206cfd2c8" },
    { "id": "guide-list-resource", "title": "Guide: List Resource", "rawUrl": "https://raw.githubusercontent.com/hashicorp/terraform-provider-azurerm/main/contributing/topics/guide-list-resource.md", "referenceUrl": "https://github.com/hashicorp/terraform-provider-azurerm/blob/main/contributing/topics/guide-list-resource.md", "baselineSha256": "6642bc6593814ff787ff7377ad14b11bfbacdc0502d2d5e823398607d84c3dff" },
    { "id": "guide-new-write-only-attribute", "title": "Guide: Adding a new Write-Only Attribute", "rawUrl": "https://raw.githubusercontent.com/hashicorp/terraform-provider-azurerm/main/contributing/topics/guide-new-write-only-attribute.md", "referenceUrl": "https://github.com/hashicorp/terraform-provider-azurerm/blob/main/contributing/topics/guide-new-write-only-attribute.md", "baselineSha256": "80c0b391cee17c52af85e3dd290cf3ca2613aa685375d8f28b60b4a979ea601c" },
    { "id": "guide-resource-identity", "title": "Guide: Resource Identity", "rawUrl": "https://raw.githubusercontent.com/hashicorp/terraform-provider-azurerm/main/contributing/topics/guide-resource-identity.md", "referenceUrl": "https://github.com/hashicorp/terraform-provider-azurerm/blob/main/contributing/topics/guide-resource-identity.md", "baselineSha256": "f88eb64456a0d6f8d2badc7a7e137af0d477155f6b71e5d0c425427d2c40913b" },
    { "id": "guide-resource-ids", "title": "Guide: Resource IDs", "rawUrl": "https://raw.githubusercontent.com/hashicorp/terraform-provider-azurerm/main/contributing/topics/guide-resource-ids.md", "referenceUrl": "https://github.com/hashicorp/terraform-provider-azurerm/blob/main/contributing/topics/guide-resource-ids.md", "baselineSha256": "48bbf9f35b636f57967bd6d2497f40d74fe131e7d8f8131fd61a78c71875e2e8" }
  ],
  "evidence": [
    { "id": "implementation-contract", "type": "source-contract", "description": "Interactive implementation contract used to select the initial Hosted implementation rules.", "reference": ".github/instructions/implementation-compliance-contract.instructions.md" },
    { "id": "testing-contract", "type": "source-contract", "description": "Interactive testing contract used to select the initial Hosted acceptance-test rules.", "reference": ".github/instructions/testing-compliance-contract.instructions.md" },
    { "id": "documentation-contract", "type": "source-contract", "description": "Interactive documentation contract used to select the initial Hosted documentation rules.", "reference": ".github/instructions/docs-compliance-contract.instructions.md" },
    { "id": "docs-list-marker-confirmation", "type": "maintainer-confirmation", "description": "Maintainer-confirmed requirement that argument and attribute entries use the contributor-template list marker.", "reference": "docs/HOSTED_COPILOT_CODE_REVIEW_ARCHITECTURE.md#published-template-convention" },
    { "id": "oxford-comma-confirmation", "type": "maintainer-confirmation", "description": "Maintainer-confirmed Oxford comma requirement retained as an upstream documentation gap.", "reference": "docs/HOSTED_COPILOT_CODE_REVIEW_ARCHITECTURE.md#oxford-comma-requirement" },
    { "id": "hosted-architecture", "type": "architecture", "description": "Hosted architecture authority for experiment safeguards and migration boundaries.", "reference": "docs/HOSTED_COPILOT_CODE_REVIEW_ARCHITECTURE.md" }
  ],
  "surfaces": [
    {
      "id": "implementation",
      "outputPath": ".github/instructions/azurerm-go.instructions.md",
      "description": "Review Terraform AzureRM provider Go implementation for Azure API, schema, state, lifecycle, identity, and error-handling defects.",
      "applyTo": "internal/**/*.go",
      "title": "AzureRM Go Review Rules",
      "introduction": "Apply these rules only when changed lines introduce or expose an actionable defect. Determine whether the file uses the typed `internal/sdk` model or untyped `pluginsdk.Resource` model before evaluating framework-specific behavior, and verify Azure API claims against generated SDK models.",
      "sections": [
        { "heading": "Evidence And Implementation Model", "ruleIds": ["IMPL-EVID-001", "IMPL-WF-001A"] },
        { "heading": "Create And Import Behavior", "ruleIds": ["IMPL-WF-002B", "IMPL-WF-002C"] },
        { "heading": "Schema And State", "ruleIds": ["IMPL-SCHEMA-001", "IMPL-SCHEMA-004", "IMPL-SCHEMA-006", "IMPL-SCHEMA-007", "IMPL-SCHEMA-008", "IMPL-SCHEMA-010", "IMPL-SCHEMA-013", "IMPL-SCHEMA-017"] },
        { "heading": "Azure Update Semantics", "ruleIds": ["IMPL-PATCH-001"] },
        { "heading": "Errors", "ruleIds": ["IMPL-ERR-001", "IMPL-ERR-002"] }
      ],
      "closing": "These rules are compact Hosted selections from the implementation compliance contract. Test lifecycle and acceptance-test conventions are deferred to the test supplement so test files do not load duplicate rule meaning."
    },
    {
      "id": "testing",
      "outputPath": ".github/instructions/azurerm-tests.instructions.md",
      "description": "Review Terraform AzureRM provider acceptance tests for lifecycle, harness, assertion, generation, configuration, and callback defects.",
      "applyTo": "internal/**/*_test.go",
      "title": "AzureRM Acceptance-Test Review Rules",
      "introduction": "Apply these rules only when changed lines introduce or expose an actionable test defect. Test files also load the shared Go rules; do not duplicate findings about general Go, schema, API, PATCH, identity, or error behavior.",
      "sections": [
        { "heading": "Evidence And Lifecycle", "ruleIds": ["TEST-EVID-001", "TEST-WF-002", "TEST-WF-002A", "TEST-WF-003", "TEST-WF-004", "TEST-WF-005"] },
        { "heading": "Assertions And Validation", "ruleIds": ["TEST-PATTERN-001", "TEST-PATTERN-002", "TEST-PATTERN-004", "TEST-PATTERN-005", "TEST-PATTERN-006"] },
        { "heading": "Generated And Embedded Content", "ruleIds": ["TEST-PATTERN-008", "TEST-PATTERN-010"] },
        { "heading": "Feature Branches And Azure Setup", "ruleIds": ["TEST-PATTERN-011", "TEST-PATTERN-012"] }
      ],
      "closing": "These rules are compact Hosted selections from the testing compliance contract. Shared Go behavior remains owned by the Go instructions."
    },
    {
      "id": "documentation",
      "outputPath": ".github/instructions/azurerm-docs.instructions.md",
      "description": "Review Terraform AzureRM resource, data source, list-resource, ephemeral-resource, and function documentation for schema accuracy, usable examples, imports, and required wording.",
      "applyTo": "website/docs/**/*.html.markdown",
      "title": "AzureRM Documentation Review Rules",
      "introduction": "Apply these rules only when the changed lines introduce or expose an actionable documentation defect. Verify schema- and implementation-dependent claims in `internal/**` before commenting.",
      "sections": [
        { "heading": "Evidence And Coverage", "ruleIds": ["DOCS-EVID-001", "DOCS-ARG-001", "DOCS-ARG-007", "DOCS-ATTR-002"] },
        { "heading": "Frontmatter And Structure", "ruleIds": ["DOCS-FM-001", "DOCS-FM-006", "DOCS-FMT-001", "DOCS-STRUCT-001", "DOCS-STRUCT-003"] },